{
  "name": "WVR Dogfight — Sidewinder vs Flares & Jink",
  "engagement_type": "air_to_air",
  "atmosphere": "ussa1976",
  "missile": {
    "template": "aim9x_sidewinder",
    "launch": {
      "position": [0, 0, 4000],
      "velocity": {"speed": 280, "heading_deg": 45, "climb_deg": 0}
    }
  },
  "target": {
    "platform": "f16_viper",
    "initial": {
      "position": [5000, 5000, 4200],
      "velocity": {"speed": 240, "heading_deg": 200, "climb_deg": 0}
    },
    "timeline": [
      {
        "trigger": {"type": "time", "value": 1.5},
        "maneuver": "break_turn",
        "params": {"g": 8.5, "direction": "left"},
        "countermeasure": {"type": "flare", "count": 6, "intensity": 1.2, "duration": 3.0}
      },
      {
        "trigger": {"type": "tti", "value": 2.5},
        "maneuver": "jink",
        "params": {"g": 8.5, "switch_period": 0.9},
        "countermeasure": {"type": "flare", "count": 4, "intensity": 1.2, "duration": 3.0}
      }
    ]
  },
  "sim": {"dt": 0.003, "max_time": 30, "output_rate_hz": 60, "hit_radius_m": 10}
}
